{
  "format": "kornode.bundle/v1",
  "node_id": 3,
  "version": 42,
  "generated_at": "2026-10-11T12:00:00Z",
  "min_agent_version": "2.0.0",
  "hubs": [
    {
      "host": "vpn.example.com",
      "port": 443,
      "pin": "pin-sha256:AAAAAAAAAAAAAAAAAAAAAAAAAAAAAAAAAAAAAAAAAAA=",
      "control_url": "https://10.99.0.1:8444"
    }
  ],
  "node": {
    "name": "node3",
    "roles": ["access"],
    "fabric_address": "10.99.0.3",
    "service_address": "10.100.3.1",
    "client_pool": "10.100.3.0/24",
    "source_range": "10.8.3.0/24",
    "uplink_hint": "auto"
  },
  "fabric": {
    "cidr": "10.99.0.0/24",
    "domain": "kornode.internal",
    "prefixes": [
      { "prefix": "10.99.0.0/24", "node_id": 1, "kind": "fabric" },
      { "prefix": "10.100.1.0/24", "node_id": 1, "kind": "pool" },
      { "prefix": "10.100.2.0/24", "node_id": 2, "kind": "pool" },
      { "prefix": "192.168.2.0/24", "node_id": 2, "kind": "lan" }
    ]
  },
  "tunnels": {
    "fabric": { "interface": "oc-hub0", "transport": "tcp", "dpd": 20, "keepalive": 25 },
    "upstreams": [
      {
        "name": "office",
        "interface": "oc-office",
        "enabled": true,
        "server": "office-vpn.example.org",
        "port": 443,
        "transport": "auto",
        "auth_type": "password",
        "username": "node3",
        "password": { "alg": "x25519-hkdf-sha256-chacha20poly1305", "epk": "BASE64", "nonce": "BASE64", "ct": "BASE64" },
        "server_cert_pin": "pin-sha256:BBBBBBBBBBBBBBBBBBBBBBBBBBBBBBBBBBBBBBBBBBB=",
        "check_host": "10.60.0.1",
        "accept_server_routes": true,
        "dns": ["10.60.0.53"]
      }
    ]
  },
  "policy": {
    "sources": [
      { "name": "amnezia", "interface": "awg0", "cidr": "10.8.3.0/24", "export": true, "description": "wg-easy Amnezia" }
    ],
    "sets": {
      "corp": { "routes": ["10.60.0.0/16"], "domains": ["corp.example.com"] }
    },
    "egress": [
      { "id": "to-fabric", "from": ["clients", "host", "amnezia"], "to": "fabric", "via": "fabric" },
      { "id": "corp", "from": ["clients", "amnezia", "host"], "to": { "set": "corp" }, "via": "upstream:office", "kill_switch": true },
      { "id": "internet", "from": ["clients", "amnezia"], "to": "any", "via": "local" }
    ]
  },
  "dns": {
    "enabled": true,
    "upstream_servers": ["1.1.1.1", "8.8.8.8"],
    "forward_zones": [
      { "zone": "kornode.internal", "servers": ["10.100.1.1"] },
      { "zone": "corp.example.com", "servers": ["10.60.0.53"] }
    ],
    "local_records": [
      { "name": "node3.kornode.internal", "type": "A", "value": "10.100.3.1" },
      { "name": "nas.node3.kornode.internal", "type": "A", "value": "192.168.3.10" }
    ],
    "blocklist_domains": []
  },
  "access": {
    "port": 443,
    "udp": true,
    "auth": ["password"],
    "ca_pem": "-----BEGIN CERTIFICATE-----\n...\n-----END CERTIFICATE-----\n",
    "server_cert_pem": "-----BEGIN CERTIFICATE-----\n...\n-----END CERTIFICATE-----\n",
    "server_key": { "alg": "x25519-hkdf-sha256-chacha20poly1305", "epk": "BASE64", "nonce": "BASE64", "ct": "BASE64" },
    "users": [
      { "username": "alice", "pw_hash": "$5$rounds=5000$examplesalt$examplehash", "groups": ["default"], "enabled": true }
    ],
    "groups": { "default": "" }
  },
  "settings": { "report_interval_seconds": 30, "confirm_window_seconds": 60, "log_level": "info" }
}
